{
  "kind": "realizationProfile",
  "id": "ordered-map-ascii-fold",
  "version": "0.1.0",
  "platform": "portable-json-runner",
  "hostCapabilities": ["process.execution"],
  "scale": "At most three put operations, three live key-equivalence classes, and three returned entries per observation.",
  "concurrency": "single-threaded lockstep requests",
  "trust": "Adapter output and reported events are untrusted until checked by the independent harness.",
  "portability": "Keys are exactly A, a, B, b, C, or c under ASCII-lowercase equivalence; values are JSON integers from -2 through 2; entry class tokens are a, b, or c.",
  "workloads": [
    {
      "id": "put-sequence",
      "startingState": "empty",
      "sizeFunction": "n is the number of consecutive put operations",
      "definition": "For every n >= 0 and every permitted length-n key/value sequence, start at empty and apply the n puts in order."
    }
  ],
  "costMeasures": [
    {
      "id": "realization-steps",
      "unit": "primitive realization step",
      "aggregation": "sum over the workload",
      "instrumentation": "Future performance instrumentation reports a nonnegative step count for every put invocation; ordered-map-runner-json-v1 does not report this measure."
    }
  ]
}
